The whiskey is all you need to get hammered!	威士忌就是你需要的全部東西才能醉倒！
A Mickey Finn will not get you anywhere.	迷幻藥滴不了事。
Great, now you've got a whiskey-soiled ribbon!	好了，現在你有條威士忌污漬的絲帶了！
You slop a little whiskey onto your carefully-scrawled graffiti.	你濺點威士忌在你精心塗寫的塗鴉上。
Infrared doesn't work on leather.	紅外線對皮革沒效。
You try to change spray channels with the remote control, but it doesn't work.	你試著用遙控器換噴霧頻道，但沒用。
You are surprised to see the watch change to another time zone, then revert back to local, Lost Wages time again!	你驚訝地看著手錶換到另一個時區，然後又改回 Lost Wages 當地時間！
You attempt to change the apple into something else with the remote control, but nothing happens.	你試著用遙控器把蘋果變成別的東西，但什麼都沒發生。
The remote control causes no change in the ring.	遙控器對戒指沒任何作用。
You DO wish the whiskey would change to a better brand!	你確實希望威士忌能變成更好的牌子！
Operating on the principle of line-of-sight infrared transmission, the remote control baffles you completely.	按照直線紅外線傳輸原理運作的遙控器，完全把你搞懵了。
You watch closely to see if the remote control affects the rose, but it doesn't.	你仔細看遙控器是否影響玫瑰，但沒有。
You try to "turn on" the lubber with your remote.	你試著用遙控器"開啟"房間。
The box of candy doesn't react to the remote control.	糖果盒對遙控器沒反應。
Using the remote control on the disco pass is futile.	用遙控器對付迪斯可通行證沒用。
You try to change blades on the pocketknife but naturally, nothing happens!	你試著換小刀的刀片，但當然，什麼都沒發生！
Using the remote, you attempt to improve the quality of the wine, but nothing happens.	用遙控器，你試著改善葡萄酒的品質，但什麼都沒發生。
Remote controls often fail to work with the print medium, Larry.	遙控器通常對印刷品沒轍，Larry。
The remote control curiously has no effect on the hammer.	遙控器奇怪地對錘子沒任何作用。
You pointlessly click the remote control at the pills.	你無意義地對著藥丸按遙控器。
The remote control has no effect on the ribbon.	遙控器對絲帶沒作用。
The graffiti doesn't become any more interesting when you click the remote control on it.	對塗鴉按遙控器不會讓它變得有趣。
You're such an incurable romantic! Pressing the rose in your wallet would be sweet, but might well ruin it!	你真是個無可救藥的浪漫鬼！把玫瑰壓進錢包會很甜蜜，但可能毀掉它！
"Take that," you cry, spanking the breath spray with the stem of your rose!	"吃我一下，"你叫著，用玫瑰莖打口氣噴霧的屁股！
The rose makes a lovely gift, but the watch isn't interested.	玫瑰是個漂亮禮物，但手錶不感興趣。
You gently the rub the tender, red, slightly-opened petals of the rose on the firm, rounded cheeks of the apple.	你溫柔地摩擦玫瑰柔軟、紅潤、微微綻放的花瓣在蘋果飽滿圓潤的「臉頰」上。
You thread the rose through the ring, which does nothing for the ring, but it does make the rose feel quite special.	你把玫瑰穿過戒指，這對戒指沒啥幫助，但玫瑰樂得不行。
Putting the rose in that rotgut will kill the poor rose.	把玫瑰放進那爛酒裡會要了玫瑰的命。
The remote control isn't remotely interested in the rose.	那遙控器一點都不鳥玫瑰。
A rose, is a rose, is a rose.	玫瑰就是玫瑰，就是玫瑰。
Ever hear of thorns, Larry? You're going to luin your lubber!	聽過刺嗎，Larry？你要戳爆你的套子了！
Rose and candy DO go together, but not now.	玫瑰配巧克力確實滿配，但現在不行。
Great idea, Larry.	妙想天開啊，Larry。
Got it! You slice off a thorn from the stem of the rose.	搞定！你從玫瑰莖上切下一根刺。
That cheap wine will only give the rose a headache.	那爛酒只會讓玫瑰頭痛。
You could press the rose in an encyclopedia, but not in a magazine.	你可以把玫瑰夾在百科全書裡，但不能夾在雜誌裡。
The rose is too delicate to do anything with the hammer.	玫瑰太嬌貴了，沒法用錘子敲。
Yes, that's the traditional place to keep lubbers, Larry, but you've got more than enough room right here.	沒錯，那是放套子的傳統地方，Larry，但你這兒地方多著呢。
Your lubber already has a delightful aroma all its own.	你的套子本來就香得不行。
Save the lubber for a higher purpose, Larry.	留著那套子幹大事吧，Larry。
The apple already has a protective skin!	蘋果本來就有保護皮！
Putting the lubber over the ring is a waste of latex.	把套子套在戒指上是浪費膠。
Tsk, tsk! You should have bought the lubricated lubbers?	啧啧！你當初應該買潤滑的套子？
Placing the lubber over the remote control will interfere with its emissions! (Of infrared light, Larry!)	把套子套在遙控器上會干擾它的發射！(紅外線啦，Larry！)
The rose's thorns would adversely affect the structural integrity of your lubber.	玫瑰的刺會搞砸你套子的結構強度。
These are more fun to use than to look at!	這東西用起來比看著爽多了！
Among others, the candy prefers to come in an attractive box.	說起來，巧克力最愛待在漂亮的盒子裡。
The disco pass has already been laminated for your protection.	舞廳通行證都層壓好了，保護你。
That's one pointy object that shouldn't be brought into contact with your lubber!	那玩意尖銳，不該碰你的套子！
The wine comes in a handy, professional-series, cardboard box.	酒來得好用，專業等級紙盒裝。
You can bet the ladies in that magazine have their own birth control devices.	保證那雜誌裡的妹子都有自己的避孕工具。
Right idea. Wrong tool.	想法對，工具錯。
Putting the pills in the lubber will only cause you great irritation later on.	把藥丸放進套子裡只會害你之後爽不了。
There's no need to put the ribbon in the lubber.	沒必要把絲帶放進套子裡。
There's no reason to protect the graffiti from anything.	沒理由保護那塗鴉。
Putting the candy in your wallet will make it sticky and mushy.	把巧克力放進皮夾會膩答答爛爛的。
There's no way to put the candy in the breath spray.	沒法把巧克力放進口氣噴霧裡。
There's no room inside the watch for the candy.	手錶裡放不下巧克力。
The apple doesn't want the candy.	蘋果不要巧克力。
It's not Cracker Jacks, Larry. You don't need a prize in every box.	這不是爆米花糖，Larry，不用每盒都要禮物。
Dunking the candy in the whiskey will spoil the candy, but it can't make that whiskey any worse.	把巧克力泡進威士忌會毀了巧克力，但那酒已經爛得不能再爛。
The candy enjoys sitting on the remote control.	巧克力喜歡坐在遙控器上。
Who ever heard of giving candy to a flower?	誰聽過送巧克力給花的？
The candy prefers to come in an attractive box.	巧克力最愛待在漂亮的盒子裡。
Candy makes the perfect present.	巧克力是完美禮物。
The candy is already the perfect size. It doesn't need further slicing.	巧克力已經完美尺寸，不用再切。
Putting the candy in the wine will not accomplish anything.	把巧克力放進酒裡不會怎樣。
It would take more than candy to make the women in your magazine go out with you, Larry.	光給巧克力是搞不定雜誌裡的妹子跟你出門的，Larry。
The candy doesn't need the hammer.	巧克力不需要錘子。
The box of candy takes no notice of the interesting graffiti.	巧克力盒不鳥那塗鴉。
Your wallet is so manly and bulging already!	你的皮夾已經鼓得夠爺們了！
The disco pass is glad to see you're equipped with breath spray.	舞廳通行證看你備著口氣噴霧樂得不行。
What is the watch going to do with the disco pass?	手錶拿舞廳通行證能幹啥？
The apple doesn't need the pass; it's with you.	蘋果不需要通行證，它跟著你呢。
The ring is totally unimpressed with the disco pass.	戒指完全不在乎舞廳通行證。
Fortunately, the lamination on the disco pass protects it from the effects of the cheap whiskey.	幸虧舞廳通行證層壓了，才擋得住那爛威士忌。
The disco pass will not gain you admittance into the tiny remote control.	舞廳通行證開不了那小遙控器的門。
There's no need to give the pass to the rose.	沒必要把通行證給玫瑰。
These things DO seem to go together, eh?	這東西確實看起來滿配，是吧？
You may need the disco pass; don't put it in the candy box.	你可能用得到舞廳通行證，別塞進巧克力盒。
The lamination is permanent; don't try to cut it off your pass.	層壓是永久的，別想從通行證上割下來。
The wine doesn't need the disco pass.	酒不需要舞廳通行證。
If the women in the magazine were real, they might be impressed with your disco pass... but then again, probably not.	要是雜誌裡的妹子是真的，也許會對你的舞廳通行證眼紅…但說實話，大概不會。
The hammer could just break its way into the disco.	錘子硬闖舞廳也行啦。
The disco pass won't fit in the little container of pills.	舞廳通行證塞不進那小藥瓶。
There's no reason to tie the pass to the ribbon.	沒理由把通行證綁到絲帶上。
The disco pass takes no notice of the graffiti.	舞廳通行證不鳥那塗鴉。
Carve your wallet? No, it's easy enough to open.	在皮夾上刻字？不用啦，開很容易。
"Do not puncture or incinerate!"	「勿穿刺或焚毀！」
There's no reason to pry the watch apart.	沒理由把手錶撬開。
Sliced apple, anyone? No, thanks, save it for later.	誰要切蘋果？不用，留著晚點吃。
You can't pry the diamond out of the ring.	你撬不出戒指上的鑽石。
It's considered bad manners to stir your whiskey with a knife.	用刀攪威士忌是不禮貌的。
Don't pry open the remote control; you'll void the warranty!	別撬遙控器，會失效保修！
You carefully snip your stem, making it slightly shorter!	你小心翼翼地剪掉莖，讓它短了一點！
Hey, be careful! Don't poke a hole with that thing.	嘿，小心點！別用那玩意戳洞。
Sliced chocolates? Forget it.	切巧克力？算了吧。
Don't cut up the disco pass, it's semi-valuable.	別把舞廳通行證剪碎，它多少值點錢。
5 blades, 7 attachments, 3 screwdrivers, 2 saws, a toothpick, a tweezer, plus MORE... much, MUCH more!!	5 把刀、7 個配件、3 把起子、2 把鋸子、一根牙籤、一把夾子，再加更多…多得不行！
What? That cheap wine will corrode away your knife's fine pot-metal blade?	啥？那爛酒會腐蝕你刀那漂亮的鋅合金刀刃？
Clipping your favorites from each issue is an old habit, but one you were going to break, remember?	每期剪下最愛的是老習慣，但你說過要改的，記得嗎？
You cleverly carve your initials into Lefty's left-handed hammer.	你聰明地在左撇子的左手錘上刻下你的首字母。
Since you're a big boy now, there's no reason to cut the pills in half.	既然你現在是大男孩了，沒理由把藥丸剪成兩半。
You've already cut the ribbon once.	你已經把絲帶剪過一次了。
Why slice the graffiti? What did it ever do to you?	幹嘛切塗鴉？它對你幹過啥？
Are you hallucinating, Larry? There's no way to put the wine in the wallet.	你幻覺啦，Larry？沒法把酒放進皮夾。
Wine-flavored breath spray would be no improvement.	酒味口氣噴霧不會更好。
The watch doesn't care for any wine right now.	手錶現在不要酒。
Don't spike the apple.	別在蘋果裡下藥。
The wine's bacterial action kills off any remaining germs from the bathroom sink.	酒的細菌作用能殺死浴室水槽剩下的細菌。
Creating a custom blend of rose whiskey, Larry?	在調玫瑰威士忌啊，Larry？
That wine will eat away at the vital innards of the remote control... as it does yours!	那酒會腐蝕遙控器的命根子…就跟對你的一樣！
"The Days of Wine and Roses...." (Another bad Sinatra impression?)	「酒與玫瑰的日子」…(又在學 Sinatra 唱歌？)
What a romantic idea; sipping wine out of your lubber.	多浪漫啊，用套子喝酒。
Well, maybe rum-soaked candy is good...	嗯，也許蘭姆酒漬巧克力不錯…
Now the disco pass reeks of cheap wine.	現在舞廳通行證臭死了，全是爛酒味。
What? And corrode that fine pot metal blade?	啥？腐蝕那漂亮的鋅合金刀刃？
You seriously question this wine's heritage.	你開始懷疑這酒的來歷。
You'll only make the pages even stickier.	你只會讓頁面更膩答答。
Drink this wine and you'll get hammered!	喝這酒你會醉死！
Pills and wine? Always a smart combination!	藥丸配酒？組合絕了！
It's a kinky idea, but it doesn't work.	想法新奇，但不行。
Pouring wine on the graffiti will definitely spoil your handwriting.	把酒倒在塗鴉上肯定會毀了你的字跡。
Trying to put the magazine in your wallet will put a crease right through the middle of Miss October.	想把雜誌塞進皮夾會在十月美女的中間折一道褶子。
You carefully wrap the magazine around your cannister of breath spray for no apparent reason.	你莫名其妙地把雜誌仔細地繞在口氣噴霧瓶上。
The magazine doesn't care what time it is.	雜誌不在乎幾點。
The women in the magazine aren't hungry... at least, not for apples!	雜誌裡的妹子不餓…至少不餓蘋果！
The magazine isn't interested in the ring.	雜誌不在乎戒指。
Dipping the magazine in the whiskey will make the pages stick together.	把雜誌泡進威士忌頁面會粘在一起。
The girls in the magazine are awed by the immense array of buttons on your virile remote control!	雜誌裡的妹子被你那充滿雄性荷爾蒙的遙控器上滿滿的按鈕搞花眼了！
