Ok.\n\nYou toss back the shot of cheap booze, then dramatically break the glass on the floor!	好！\n\n你一飲而盡那杯爛酒，然後戲劇性地把玻璃杯砸在地上！
Thanks for playing "Leisure Suit Larry in the Land of the Lounge Lizards."\n\nYou screwed up this game, but you can probably do better.\n\nCome on, let's do it just one more time!	感謝遊玩《Leisure Suit Larry in the Land of the Lounge Lizards》。\n\n你把這遊戲玩砸了，但下次應該能做得更好。\n\n來吧，再玩一次！
Since you're dead...\n\nall you can do is restore a saved game or start over.	你已經掛了…\n\n現在只能重新讀檔或重新開始。
You don't have it.	你沒有那東西。
Sorry, this is a real-time game!	抱歉，這是即時遊戲！
You find your leisure suit very stylish, but empty.	你的豔裝套裝很時髦，但口袋空空。
You have no need to take it.	你沒必要拿它。
You might need it.	你可能會用到它。
Following your conviction for bestiality, you spend the rest of your life in prison, turning big rocks into little ones!	在獸交罪名定罪後，你在獄中度過餘生，把大石頭砸成小石頭！
"Same to you!"	「彼此彼此！」
Once you tasted it, you wouldn't want it!	嚐過一次後，你就不會想再碰了！
Without thinking, you down the entire bottle. Hey, this stuff is ok! Your breathing becomes heavy, and you're suddenly extremely horny! You've just got to do something, and right NOW!\n\nHey, where's that cute, black dog?	二話不說，你把整瓶灌下去。嘿，這東西還不錯！呼吸變得沉重，你忽然慾火焚身！你得馬上做點什麼！\n\n嘿，那隻可愛的黑狗呢？
Wouldn't you rather just remain friends?	妳不想保持朋友關係嗎？
Don't whine!	別嗯嗯唧唧的！
Funny, no response.	奇怪，沒反應。
It doesn't look interesting.	看起來沒什麼意思。
You see nothing special.	沒有什麼特別的。
It's just as it appears.	就是看起來那樣。
How can you do that?	你怎麼做得了？
You don't need it.	你用不著。
There's no reason to take it.	沒理由拿它。
Just walk there.	就直接走過去吧。
Oh, %w1, %w1, %w1! Doesn't anybody _____ anymore?	哎呀，%w1、%w1、%w1！沒人要_____ 了嗎？
What would you do with the %w2	你拿 %w2 來幹嘛
How can you use that which you do not have?	你沒有的東西怎麼用？
You're not close enough.	你靠得不夠近。
You already have it.	你已經有了。
That comes later.	那以後再說。
Restart  <F9>	重新開始  <F9>
See Object      	查看物體
Bodily Function 	生理機能
Sound On/Off      <F2>	音效開/關      <F2>
Graphics Mode <Ctrl-R>	圖形模式 <Ctrl-R>
Clock On/Off          	時鐘開/關
Pause Game            	暫停遊戲
Yep, it's a door!	沒錯，這就是一扇門！
Watch it, Larry. You're going to get your face slapped!	小心點，Larry。妳再來會被甩巴掌！
Ok.\n\nYour thirst is gone, the bottle is empty, and your breath is revolting.	好。\n\n你不渴了，瓶子空了，你的口氣臭死人。
"Hey, dork! You've got toilet paper stuck to your shoe!"	「嘿，呆瓜！你鞋上貼著衛生紙！」
"Phew! You smell like a used fire hydrant!"	「呸！你聞起來像用過的消防栓！」
   This is about the extent of\n    your mathematical abilities.	   這大概就是你的\n    數學能力的極限了。
How's this thing work, anyway?	這東西到底怎麼用？
Enter function: 	輸入功能：
You quickly turn around, %s11, and feel much better. A hint of a smile crosses your lips.	你快速轉身，%s11，感覺好多了。嘴角浮起一絲笑容。
Larry, the whole idea was to stop doing that!	Larry，整個想法就是要你停止那樣做！
do nothing	什麼都不做
You talk to yourself, and find you already know what you're going to say.	你跟自己說話，發現你早就知道自己要說什麼。
Good idea. You carefully remove and dispose of it properly.	好主意。你小心地把它移除並妥善處理。
You nonchalantly scrape it off.	你若無其事地把它刮掉。
Oh, no! You are now penniless. You hock your leisure suit, and spend the rest of your life on skid row eating discarded fast food.	糟糕！你現在身無分文了。你把豔裝套裝當了，在貧民窟裡靠吃剩飯度過餘生。
The rest of your story is too sad to tell. Time for a little "R & R," Larry -- Restart or Restore!	你的故事太悲慘了，說不出來。現在該放鬆放鬆了，Larry——重新開始或讀檔！
It smells as bad as you imagined.	聞起來跟你想的一樣臭。
It's not for using; IT'S A JOKE!!	不是用的；這是笑話！！
Same to you, buddy!	彼此彼此，老兄！
And %w1 %w2 you, too!	還有 %w1 %w2 你，也是！
Yeah, you probably would, too!	是啊，你可能也會這樣做！
Ok, but I don't usually do that!	好啦，但我不常幹這種事！
You press the button on the remote control and...	你按下遙控器的按鈕，然後...
...nothing happens.	...什麼都沒發生。
Wearing the magic ring gives you powers far beyond those of...	戴上魔法戒指讓你擁有超越...的力量
...Oops. Wrong game.	...哎呀，玩錯遊戲了。
Pretty dramatic, eh?	還滿戲劇化的吧？
It smells good.	聞起來不賴。
You can't. There's no key in this game!	不行啦。這遊戲沒有鑰匙！
"Eeeyow! Do something about that breath of yours!"	"哇靠！你那嘴氣也該治治啦！"
"Remember to buy more Sierra three-dimensional, graphic, adventure games!"	"別忘了多買 Sierra 的 3D 冒險遊戲！"
You might want to read them.	你可能得讀一下。
Staring at the walls?	在瞪牆壁？
Climbing the walls already?	已經要爬牆了？
It just lies there, under your feet.	它就躺在你腳下。
It tastes delicious. But nothing happens.	嚐起來很不錯。但什麼都沒發生。
Exactly how would you help?	你到底要怎麼幫？
You'd better not. You might get your face slapped!	別啦。小心被打巴掌！
Your mouth tastes like the inside of a motorman's glove!	你嘴巴嚐起來像公車司機手套的內層！
Your breath smells like floor sweepings from a rendering plant.	你的氣味像肉品廠掃地垢。
Your breath is enough to take your breath away.	你的口氣足以讓你自己都倒胃。
Your mouth tastes like the drippings from a marathon runner's sock.	你嘴巴味道像馬拉松選手襪子的汗垢。
It's still up there!	它還在上面！
It tastes delicious, but what about your acne?	嚐起來很棒，但你的青春痘咧？
There's no answer. Try opening it.	沒人應。試試打開它。
You find nothing.	你什麼都沒找到。
Well, well. It looks like this month's issue is filled with intelligent, literary articles with redeeming social value.	嗯呃，這期雜誌看起來全是聰慧文藝、具社會價值的文章。
Since your breath sprayer is empty, you toss it away.	既然口氣噴霧空了，你就扔了它。
You used it all, remember.	你全用完了，還記得吧。
No place in Lost Wages accepts credit cards from the First National Bank of Libya.	失落城沒地方收利比亞第一國家銀行的卡。
Obviously, restraint is no problem for you, Larry.	明顯地，節制對你不構成問題，Larry。
There's no time!	沒時間了！
That's an idea; it's just not a good idea!	這是個主意；就是不是個好主意！
OK, but now it's gone forever!	好吧，但現在它永遠沒了！
"Hey, thanks a lot!"	"嘿，謝謝啦！"
But, now you'll NEVER get it back!	但，現在你永遠拿不回來了！
No one wants that!	誰都不要那個！
Pretty good company, eh?	滿不錯的同伴吧？
So far, so good.\n\nNow for the final question.	到此為止都不錯。\n\n現在是最後一題。
Question #%v96. Correct answer is %v93.	第 %v96 題。正確答案是 %v93。
Please answer a, b, c, or d: 	請選擇 a、b、c 或 d：
Dynamic logic = 3.	動態邏輯 = 3.
Dynamic logic = 4.	動態邏輯 = 4.
Warning:\n\n"Leisure Suit Larry in the Land of the Lounge Lizards" contains some elements of plot which may not be  considered appropriate for some children.	警告：\n\n「休閒西裝賴瑞在鬼混蜥蜴樂園」包含某些可能不適合兒童的情節元素。
To verify you are really %v209, please answer five simple questions.	為了確認你確實是 %v209，請回答五個簡單問題。
Sorry.\n\nThis game can only be played by adults, or with an adult.\n\nPlease find an adult, come back, and try again.	抱歉。\n\n這個遊戲只能由成年人或與成年人一起玩。\n\n請找一個成年人，回來，再試一次。
Oops. You blew that one!\n\nIf you miss another, you can't possibly be %v209.	哎呀。你搞砸了那個！\n\n如果你再錯一個，你不可能是 %v209。
You're a kid!!\n\nShame on you for trying to deceive a friendly game like this!\n\nPlease play again when you're older.	你是小孩！！\n\n你真丟臉，竟然想騙一個友善的遊戲！\n\n等你長大再玩吧。
         Thank you.\n\nAnd now, slip into your leisure suit and prepare to enter the "Land of the Lounge Lizards" with "Leisure Suit Larry!"	         謝謝你。\n\n現在，穿上你的休閒西裝，準備和「休閒西裝賴瑞」一起進入「鬼混蜥蜴樂園」！
         Warning!\n\nThis game may be hazardous to those with heart conditions!	         警告！\n\n這個遊戲對心臟不好的人可能很危險！
No, you're not!	不，你不是！
Question #%v208. Correct answer is %v211.	問題 #%v208。正確答案是 %v211。
Hey! You're not alive yet.	嘿！你還沒出生呢。
The Sierra adventure team races to your rescue, dumping your worthless, leisure suit- clad hulk into their giant bit bucket, for recycling into future games. Their underground workshop is humming with activity. This is "Where Adventurers Are Made, Not Born!"	山塞拉冒險隊趕來救你，把你那穿著休閒西裝的無用軀殼丟進他們的大回收桶，用來為未來的遊戲回收利用。他們的地下工作室嗡嗡作響。這是「冒險家的製造廠，不是出生地！」
Commander Cavin quickly assembles a replacement Larry, while subordinates repair players damaged in other Sierra adventure games.	卡文司令迅速組裝了一個替代賴瑞，而下屬則修復了在其他山塞拉冒險遊戲中受損的玩家。
With your new body and ego, you are returned to fight again the battles of Lost Wages!\n\n(Now you know what we have to go through every time you press that "Restart" key.)	用你的新身體和自尊心，你被送回去再次與失樂城的戰鬥！\n\n（現在你知道每次你按下「重新開始」鍵時我們要經歷什麼了。）
Larry, when are you gonna learn to stay out of those dark alleys!!	賴瑞，你什麼時候才能學會不進那些黑暗小巷！！
"Hey guys!! He's screwed up again! Dump this one down the tubes, and get him another body!"	「嘿，傢伙們！！他又搞砸了！把這個沖進下水道，給他換個身體！」
Since you're dead, why are you talking?? Just hang on for the ride.	既然你已經死了，為什麼還在說話？？只管享受這趟旅程吧。
It appears he wants something -- YOU! Get out of here!	看起來他想要什麼——你！滾出去！
The cabbie snarls a "Where to, buddy?" as he swings the meter flag down.	計程車司機惡狠狠地說：「去哪兒，老兄？」同時按下計程表。
"Lookin' for action, eh? Dis town is full of it. We gotta disco that's usually full of foxes this time of night. Den dere's the casino, next to the all-night weddin' chapel. And we gotta lovely bar, but you've been dere. Me, I like da convenience store next to da disco, but of course, that's just personal preference."	「尋求刺激是吧？這鎮上多得是。咱們有間舞廳，這鐘點通常美女滿滿。然後啊，還有賭場，就在全天候禮拜堂隔壁。咱還有間不錯的酒吧，你去過啦。我個人嘛，比較喜歡舞廳旁的便利店，當然啦，這只是個人偏好。」
"It won't take us long to get back dere, but I'll have to circle 'round da block."	「回那邊不會花太久，不過我得繞過街區。」
"Well, here we are, buddy. That'll be $%v200.00."	「好啦，到了老兄。該給 $%v200.00。」
"So, wadda we gonna do, buddy? Ya just gonna sit here all night? I gotta earn a livin' too, ya know!"	「那怎樣啦，老兄？你要在這坐整晚嗎？我也得賺口飯吃啊！」
"Why don'cha wait'll we git there, buddy?"	「為啥不等咱們到那兒再說，老兄？」
"Sorry, but the meter's runnin'. Where ja wanna go?"	「抱歉，計程表在跑。你要去哪兒？」
"Thanks, buddy. Maybe I'll see ya again sometime!"	「謝了，老兄。也許哪天還會見面！」
"Waddaya tryin' to do, peahead! You're not gonna stiff me, and get away with it!"	「你在搞什麼呢，傻瓜！別想賴帳溜掉！」
You wish you hadn't. Mr. America, he ain't. His strongest feature seems to be his odor!	你會後悔看他。美國先生他不是。他最突出的特徵好像是他的臭味！
He wonders why you keep looking at him, and flashes a coy little smile back at you in the mirror. Your stomach turns, and not from the ride!	他納悶你為啥一直看他，在鏡子裡回給你個嬌羞的微笑。你的胃翻江倒海，不是暈車！
The driver looks at you and says, "Hey! What's that you got? Wine?" He grabs your bottle of wine, and guzzles it down!	司機看著你說：「嘿！你拿的啥？紅酒？」他一把搶過你的酒瓶，猛灌下肚！
"Ok, but it'll cost ja extra!"	「好吧，不過要加錢！」
"Waddaya mean, 'no money!!'" snarls the driver. "Step outside my office, chump!"	「什麼叫『沒錢！！』」司機怒吼。「滾出我的車，傻瓜！」
"Ok. You got it, Mac!"	「好啦，沒問題，老兄！」
