You show your genuine vinyl-style wallet to the ring, but it doesn't respond.	You show your genuine vinyl-style wallet to the ring, but it doesn't respond.
Seeking that "leatherette" taste, you foolishly dip your wallet in the whiskey.	Seeking that "leatherette" taste, you foolishly dip your wallet in the whiskey.
The remote control has no use for your wallet.	The remote control has no use for your wallet.
You offer to pay Rose, but it humbly declines.	You offer to pay Rose, but it humbly declines.
No, no, no! That's not what lubbers are for!	No, no, no! That's not what lubbers are for!
Your wallet won't fit in the candy box.	Your wallet won't fit in the candy box.
The disco pass is already paid for.	The disco pass is already paid for.
The pocket knife seems unimpressed with your wallet.	The pocket knife seems unimpressed with your wallet.
You foolishly dip your wallet into the wine.	You foolishly dip your wallet into the wine.
The girls in the magazine are mightily impressed with your manly, bulging wallet.	The girls in the magazine are mightily impressed with your manly, bulging wallet.
There's no need to put the wallet on the hammer.	There's no need to put the wallet on the hammer.
Try as you might, you can't stuff the wallet into the pill container.	Try as you might, you can't stuff the wallet into the pill container.
You show the wallet to the ribbon, but (strange but true) it doesn't respond.	You show the wallet to the ribbon, but (strange but true) it doesn't respond.
You place the graffiti in your wallet (but it still shows up here!).	You place the graffiti in your wallet (but it still shows up here!).
Don't waste precious breath spray on your wallet.	Don't waste precious breath spray on your wallet.
Yep. It's your breath spray.	Yep. It's your breath spray.
A little breath spray makes even the cheapest watch shine like gold (plate).	A little breath spray makes even the cheapest watch shine like gold (plate).
The apple was previously well-sprayed with an assortment of interesting chemical compounds.	The apple was previously well-sprayed with an assortment of interesting chemical compounds.
That ought to kill the taste of Lefty's sink!	That ought to kill the taste of Lefty's sink!
No amount of breath spray will help the taste of this stuff.	No amount of breath spray will help the taste of this stuff.
The remote control's keys are sticky enough already.	The remote control's keys are sticky enough already.
The rose smells good enough already.	The rose smells good enough already.
Your breath spray will clash with that natural minty taste of latex.	Your breath spray will clash with that natural minty taste of latex.
The candy smells great just the way it is.	The candy smells great just the way it is.
Perhaps you should use the breath spray AT the disco instead!	Perhaps you should use the breath spray AT the disco instead!
It's pointless to freshen your knife's breath, let alone its width!	It's pointless to freshen your knife's breath, let alone its width!
Mmm, Chablis with a hint of wintergreen! You may have something there.	Mmm, Chablis with a hint of wintergreen! You may have something there.
Better not, the pages are sticky enough already.	Better not, the pages are sticky enough already.
Now the hammer is minty fresh.	Now the hammer is minty fresh.
That would ruin the wonderful medicinal flavor of the pills.	That would ruin the wonderful medicinal flavor of the pills.
Yeah, great idea.	Yeah, great idea.
You'd better not; you don't want to smear your writing.	You'd better not; you don't want to smear your writing.
Your watch won't fit in your already bulging wallet.	Your watch won't fit in your already bulging wallet.
Your breath spray couldn't care less what time it is.	Your breath spray couldn't care less what time it is.
Pretty clever! "Watch the apple!!"	Pretty clever! "Watch the apple!!"
The expensive ring, seeing your cheap watch, exudes a strong sense of superiority.	The expensive ring, seeing your cheap watch, exudes a strong sense of superiority.
You dip your watch in the whiskey, then give it a licking, yet it keeps on ticking!	You dip your watch in the whiskey, then give it a licking, yet it keeps on ticking!
Is there something good to "watch" on TV, Larry?	Is there something good to "watch" on TV, Larry?
So you want to time the rose?	So you want to time the rose?
That should make your cheap watch waterproof!	That should make your cheap watch waterproof!
Hiding your watch in the box of candy won't get you anywhere.	Hiding your watch in the box of candy won't get you anywhere.
The pass couldn't be less interested.	The pass couldn't be less interested.
To a pocketknife, time is relative.	To a pocketknife, time is relative.
You idiotically dip your watch into the wine. How much punishment can these things take?	You idiotically dip your watch into the wine. How much punishment can these things take?
Almost time to buy the next issue!	Almost time to buy the next issue!
The hammer doesn't want to watch.	The hammer doesn't want to watch.
The watch won't fit into the little pill container.	The watch won't fit into the little pill container.
You attempt to measure the length of the ribbon with your watch, and find it's about 30 seconds long!	You attempt to measure the length of the ribbon with your watch, and find it's about 30 seconds long!
What a stupid thing to try.	What a stupid thing to try.
The apple won't fit in your already-bulging wallet.	The apple won't fit in your already-bulging wallet.
"Warning: do not try to puncture the breath spray with an apple."	"Warning: do not try to puncture the breath spray with an apple."
The watch concentrates on keeping time and ignores your apple.	The watch concentrates on keeping time and ignores your apple.
This Red Delicious is not suitable for your Granny Smith, but someone else might find it appropriate.	This Red Delicious is not suitable for your Granny Smith, but someone else might find it appropriate.
No, the apple doesn't fit through the ring.	No, the apple doesn't fit through the ring.
You fruitlessly attempt to wedge the apple into the whiskey glass.	You fruitlessly attempt to wedge the apple into the whiskey glass.
Having no infrared circuitry, the apple fails to interface with the remote control.	Having no infrared circuitry, the apple fails to interface with the remote control.
The apple and the rose, two of nature's most perfect creations. So what?	The apple and the rose, two of nature's most perfect creations. So what?
The apple already has a protective skin. Don't bite either one!	The apple already has a protective skin. Don't bite either one!
The apple won't fit in the candy box.	The apple won't fit in the candy box.
The disco pass prefers saltier snacks.	The disco pass prefers saltier snacks.
There's no need to peel the apple.	There's no need to peel the apple.
Larry, it's pears in tequila bottles, not apples in wine boxes.	Larry, it's pears in tequila bottles, not apples in wine boxes.
Seeing the melons on the front of that magazine, the apple develops an inferiority complex.	Seeing the melons on the front of that magazine, the apple develops an inferiority complex.
Applesauce. Good idea.	Applesauce. Good idea.
You try to core the apple with the pill bottle, but are unable to remove the child safety lid!	You try to core the apple with the pill bottle, but are unable to remove the child safety lid!
"Tie a pink ribbon round your old apple..." Nah. That just doesn't make it, Larry.	"Tie a pink ribbon round your old apple..." Nah. That just doesn't make it, Larry.
The apple is shocked and confused by the strange graffiti.	The apple is shocked and confused by the strange graffiti.
The ring might puncture the thin vinylette of your El Cheapo wallet.	The ring might puncture the thin vinylette of your El Cheapo wallet.
The breathspray looks at the ring in surprise! "Why, this is so sudden!"	The breathspray looks at the ring in surprise! "Why, this is so sudden!"
If clocks chime, do watches "ring?"	If clocks chime, do watches "ring?"
Putting the ring in the apple might spoil its lustrous shine! (The apple's, that is!)	Putting the ring in the apple might spoil its lustrous shine! (The apple's, that is!)
When you gaze deep into the diamond, you seem to hear the sound of wedding bells, and maybe diesel trucks.	When you gaze deep into the diamond, you seem to hear the sound of wedding bells, and maybe diesel trucks.
Checking for dissolvable solids, you dip the ring into the whiskey. Nothing happens.	Checking for dissolvable solids, you dip the ring into the whiskey. Nothing happens.
Just for fun, you use the ring to press some buttons on the remote control.	Just for fun, you use the ring to press some buttons on the remote control.
It's no use, the rose is already engaged to some pansy.	It's no use, the rose is already engaged to some pansy.
That's a creative way to give someone a ring.	That's a creative way to give someone a ring.
You smear chocolate all over the ring, then lick it all off. Was that fun or what?	You smear chocolate all over the ring, then lick it all off. Was that fun or what?
The disco pass has no use for the ring.	The disco pass has no use for the ring.
You rub the diamond on the blade of your pocket knife and sharpen it ever so slightly.	You rub the diamond on the blade of your pocket knife and sharpen it ever so slightly.
Using the diamond, you scratch your initials into the cardboard box of wine.	Using the diamond, you scratch your initials into the cardboard box of wine.
These are only photographs of girls, Larry. None of them will marry you.	These are only photographs of girls, Larry. None of them will marry you.
The ring won't fit on the hammer.	The ring won't fit on the hammer.
Don't put the ring in with the pills. You might accidentally swallow it.	Don't put the ring in with the pills. You might accidentally swallow it.
Your ribbon WOULD look sweet with a cute little bow, but you decide to save the ribbon to use elsewhere.	Your ribbon WOULD look sweet with a cute little bow, but you decide to save the ribbon to use elsewhere.
The ring read the graffiti while it was sitting on the sink.	The ring read the graffiti while it was sitting on the sink.
Your wallet is stained enough already.	Your wallet is stained enough already.
You don't really want "Morning in the Distillery" breath?	You don't really want "Morning in the Distillery" breath?
You drop a little whiskey on your watch, just to clean the crystal.	You drop a little whiskey on your watch, just to clean the crystal.
Is whiskey and apples an old family recipe?	Is whiskey and apples an old family recipe?
You dribble a bit of whiskey onto the ring, hoping to kill the germs from the bathroom sink.	You dribble a bit of whiskey onto the ring, hoping to kill the germs from the bathroom sink.
There is a strong odor of petroleum by-products coming from this glass.	There is a strong odor of petroleum by-products coming from this glass.
"I'll bet a little whiskey would make that remote control more powerful," you conjecture mistakenly.	"I'll bet a little whiskey would make that remote control more powerful," you conjecture mistakenly.
If the rose isn't already dead, that rotgut will put it out of its misery.	If the rose isn't already dead, that rotgut will put it out of its misery.
Nobody's going to want to drink the whiskey after you've poured it in THERE!	Nobody's going to want to drink the whiskey after you've poured it in THERE!
The candy is already well-soaked.	The candy is already well-soaked.
You dribble a little whiskey on the pass to remove that "never used" sheen.	You dribble a little whiskey on the pass to remove that "never used" sheen.
Don't you know? Whiskey and weapons don't mix!	Don't you know? Whiskey and weapons don't mix!
Yes, a good malt Chablis is tough to find.	Yes, a good malt Chablis is tough to find.
That will only make the pages even more sticky.	That will only make the pages even more sticky.
The whiskey is all you need to get hammered!	The whiskey is all you need to get hammered!
A Mickey Finn will not get you anywhere.	A Mickey Finn will not get you anywhere.
Great, now you've got a whiskey-soiled ribbon!	Great, now you've got a whiskey-soiled ribbon!
You slop a little whiskey onto your carefully-scrawled graffiti.	You slop a little whiskey onto your carefully-scrawled graffiti.
Infrared doesn't work on leather.	Infrared doesn't work on leather.
You try to change spray channels with the remote control, but it doesn't work.	You try to change spray channels with the remote control, but it doesn't work.
You are surprised to see the watch change to another time zone, then revert back to local, Lost Wages time again!	You are surprised to see the watch change to another time zone, then revert back to local, Lost Wages time again!
You attempt to change the apple into something else with the remote control, but nothing happens.	You attempt to change the apple into something else with the remote control, but nothing happens.
The remote control causes no change in the ring.	The remote control causes no change in the ring.
You DO wish the whiskey would change to a better brand!	You DO wish the whiskey would change to a better brand!
Operating on the principle of line-of-sight infrared transmission, the remote control baffles you completely.	Operating on the principle of line-of-sight infrared transmission, the remote control baffles you completely.
You watch closely to see if the remote control affects the rose, but it doesn't.	You watch closely to see if the remote control affects the rose, but it doesn't.
You try to "turn on" the lubber with your remote.	You try to "turn on" the lubber with your remote.
The box of candy doesn't react to the remote control.	The box of candy doesn't react to the remote control.
Using the remote control on the disco pass is futile.	Using the remote control on the disco pass is futile.
You try to change blades on the pocketknife but naturally, nothing happens!	You try to change blades on the pocketknife but naturally, nothing happens!
Using the remote, you attempt to improve the quality of the wine, but nothing happens.	Using the remote, you attempt to improve the quality of the wine, but nothing happens.
Remote controls often fail to work with the print medium, Larry.	Remote controls often fail to work with the print medium, Larry.
The remote control curiously has no effect on the hammer.	The remote control curiously has no effect on the hammer.
You pointlessly click the remote control at the pills.	You pointlessly click the remote control at the pills.
The remote control has no effect on the ribbon.	The remote control has no effect on the ribbon.
The graffiti doesn't become any more interesting when you click the remote control on it.	The graffiti doesn't become any more interesting when you click the remote control on it.
You're such an incurable romantic! Pressing the rose in your wallet would be sweet, but might well ruin it!	You're such an incurable romantic! Pressing the rose in your wallet would be sweet, but might well ruin it!
"Take that," you cry, spanking the breath spray with the stem of your rose!	"Take that," you cry, spanking the breath spray with the stem of your rose!
The rose makes a lovely gift, but the watch isn't interested.	The rose makes a lovely gift, but the watch isn't interested.
You gently the rub the tender, red, slightly-opened petals of the rose on the firm, rounded cheeks of the apple.	You gently the rub the tender, red, slightly-opened petals of the rose on the firm, rounded cheeks of the apple.
