\nInsurance bets are offered whenever the dealer shows an ace. They are half your bet, and pay 2 to 1 odds.\n\nYou may split a pair or surrender whenever you have only two cards.\n\nYou may double down if your cards total 10 or 11 points.\n	\n莊家出 A 就可買保險，賭金是下注的一半，贏率 2:1。\n\n任何時刻只有兩張牌可以分牌或投降。\n\n牌數合計 10 或 11 點可加倍下注。\n
\nPress F4 when ready to play.\n\nPress F6 for another card.\n\nPress F8 to stand.\n\nTo change the amount of your bet, type "change bet."\n	\n準備好按 F4 開始。\n\n要牌按 F6。\n\n停牌按 F8。\n\n改下注金額輸入「change bet」。\n
You are in the Casino's hotel. Doors line each side, many with "Do Not Disturb" signs on their doorknobs.	你在賭場旅館內。四周盡是旅館房門，許多門把上掛著「請勿打擾」的牌子。
There's a door with a heart on it to the west.	西邊有扇心形門。
Not one for those long elevator rides, eh, Larry?	不喜歡長坐電梯啊，Larry？
You rap your knuckles on the door. There is no response, but now your knuckles hurt.	你敲門。沒人應，反而敲痛了自己的手。
Fawn's delicate voice booms out across the hotel:\n\n"Just a minute, Larry!"	Fawn 嬌柔的聲音在旅館內炸開：\n\n「稍等，Larry！」
There's a click as she unlocks the door, then a piercing "Come on in. The door's open."	咔一聲開鎖，接著傳來尖銳的「進來，門開了。」
You can't. This door is locked.	不行。門鎖了。
Subtly, you shout, "Here I come, baby!"	你喊道：「寶貝，我來了！」（一點也不含蓄）
It's a door not unlike all the others, except this one has a cute, trite, cracked, little, plastic heart stuck to it with a thumbtack.	跟其他門沒兩樣，除了用圖釘黏著一個可愛又俗氣、裂開的小塑膠心。
It's a door just like all the others.	就是普通的旅館房門。
They almost look real, don't they?	看起來挺真實的，是吧？
You seem surprised that the door is locked.	你看起來驚訝門被鎖了。
You close the door behind you, and jiggle the knob to confirm it is locked.	你關上身後的門，扭了一下把手確認門鎖著。
Isn't it funny how the elevator is always waiting for you?	電梯老是為你等著，挺諷刺吧？
The cheap, plastic heart is not worth the bother.	廉價塑膠心不值得費力。
Fawn's sexy voice oozes through the door, "Oh, baby, it's you! You're back!!"	Fawn 性感的聲音從門裡滲出來：「喔寶貝，是你！你回來了！！」
There's a click as she unlocks the door. "Come on in, you wonderful hunk!"	咔一聲開鎖。「進來，你這性感的傢伙！」
It's no good. The door resists all of your efforts.	沒轍。門硬是不動。
You contemplate expec- toration, but remember that discretion is the better part of valium.	你想吐，但想起沉著才是冷靜之母。
...or helium,	…或是氦氣之類的。
...or something.	…某個什麼啦。
Suicide is illegal here.	這裡自殺犯法。
You rap your knuckles on the nearest door.	你敲了最近的那扇門。
This must not be the right door, Larry.	Larry，這肯定不是對的門。
"Hey, Scott, the girls are here!!"	「嘿，Scott，女孩們來了！！」
"It says 'Do NOT Disturb!' Can't you read?"	「上面寫『請勿打擾』！你不識字？」
You hear some extremely heavy breathing.	你聽到極度粗重的呼吸聲。
"Go away! I gave at the office!"	「滾開！我在辦公室已經獻了！」
"Oh, Russ, there's someone at the door!"\n\n"They're gonna have to wait, Kim Baby! It's too late for me to stop now!!"	「喔，Russ，有人敲門！」\n\n「他們得等著，Kim 寶貝！我現在停不下來了！！」
"Baaaaah. Baaaaah!"\n\nDon't even ask, Larry!	「巴—巴—」\n\nLarry，別問，真的別問。
"Oh, Bruce!\nOh, Howard!\n\nOh, Terri!\nOh, Carrie!"	「喔，Bruce！\n喔，Howard！\n\n喔，Terri！\n喔，Carrie！」
"Ken! Get off me, Ken!!"	「Ken！下來，Ken！！」
"Oh, gawd, Ed!! Get in the closet. It's my husband!!"	「天哪，Ed！！躲衣櫥裡。是我老公！！」
"Bobbit, is that you?"	「Bobbit，是你嗎？」
"Not now; I've got wessonality!"	「現在不行，我脂肪慾旺！」
"Is that Room Service? I didn't order anchovies."	「客房服務？我沒點鯷魚啊。」
An eye appears at the peephole. "Hey, Mary! Isn't it a little early for Trick or Treaters?"	從貓眼裡出現一隻眼睛。「嘿，Mary！要糖果日還早吧？」
"Oh, gawd, Ed!! Get in the closet. It's my wife!!"	「天哪，Ed！！躲衣櫥裡。是我老婆！！」
Hmmm. Is that the smell of burning rubber?	嗯？那是輪胎燒焦的味道？
"Oh, Jeff. You really know how to hurt a guy!"	「喔，Jeff。你真會傷人！」
"Get away from him, you big bully! He's mine."	「滾開，你這大壞蛋！他是我的。」
Your are in the casino hotel's honeymoon suite. The heart-shaped bed is just waiting for you and Fawn. The dim lighting provides the perfect atmosphere. You've always appreciated the "Early American Gaudy" look. There is a radio on the shelf behind the bed.	你在賭場旅館的蜜月套房。心形床靜靜等著你和 Fawn。昏黃燈光營造完美氛圍。你向來欣賞那種「美式奢華」風格。床後的架子上放著一台收音機。
This is the honeymoon suite. The heart-shaped bed would have been perfect for you and Fawn. Too bad things worked out like this!	這是蜜月套房。心形床本來是你和 Fawn 的完美去處。可惜事與願違！
The radio interrupts the Frank Sinatra medley with an obnoxious singing commercial...	收音機打斷 Frank Sinatra 的歌曲組合，放起討人厭的歌唱廣告……
"We're Ajax Liquor,\nand we're proud to say,\nwe deliver all across\nthe U.S.A."	「我們是 Ajax 酒類，\n我們驕傲地說，\n我們送遍\n整個美國。」
"You're out of luck\nif you want to dine,\nbut if you just need booze,\ndial 555-8039!"	「想吃飯沒運氣，\n但要喝酒有辦法，\n打電話 555-8039！」
Sounds like a nice mellow station...	聽起來是不錯的輕音樂頻道……
"And now, back to our music."	「現在回到我們的音樂。」
Click.	喀。
She doesn't appear to be in the mood yet, Larry.	Larry，她看起來還沒做好準備。
Good idea. Unfortunately, you have nothing with which to cut a rope, Larry.	好主意。可惜 Larry，你沒有剪繩子的東西。
Right!\n\nUsing the pocket knife you got from the old bum by the convenience store, you saw through the ropes holding you to the bed.	對了！\n\n你用從便利店外那個乞丐手上拿到的小刀，把綁著你的繩子鋸斷。
You never know when a nice piece of rope will come in handy.	一條好繩子遲早有用。
Since you have no way of cutting the ropes, and they're far too tightly tied for you to loosen, it looks like this is the end for you, Larry.	由於無法剪繩子，繩子又綁得死緊，Larry，看來你完蛋了。
You can't. She fastened them quite securely!	不行。她綁得牢牢的！
You can't. You're tied to a bed!	不行。你被綁在床上！
She is so beautiful you want to do wonderful things to, er, ah, FOR her.	她太漂亮了，你想為她…不對，跟她…做美好的事。
"You know, a little wine would help me get in the mood, Larry."	「你知道，點紅酒會讓我比較有心情，Larry。」
"I'd think the least a gentleman would do is to buy a lady a bottle of wine."	「紳士最起碼應該買瓶酒給女士吧。」
She looks ready, Larry.	Larry，她看起來準備好了。
She says, "Lie down, Larry. I have a special surprise for you!"	她說：「躺下，Larry。我有個驚喜給你！」
Then she says, "Close your eyes," and you do because you're sure that, finally, success is at hand.	接著她說：「閉上眼睛。」你依言照做，因為你確信終於要成功了。
"Oh, Fawn!" you moan.	「喔，Fawn！」你呻吟。
You grab your wallet and look inside.\n\nOh, well. At least she didn't find the %v90 bucks you hid in that secret compartment. With your consummate gambling skills, you should be back on your feet in no time!	你掏出錢包看裡面。\n\n算了。至少她沒發現你藏在暗格裡的 %v90 塊。以你高超的賭技，馬上就能東山再起！
You're tied to the bed and can't move.	你被綁在床上，動不了。
When Fawn has you securely tied to the bed, she grabs your wallet, saying, "You forgot to pay me for the wine," then heads out the door.	當 Fawn 把你綁牢後，她搶了你的錢包，說：「你忘了付我酒錢。」然後走出門。
"FAWN! Come back!" you shout. "This isn't funny!!"	「Fawn！回來！」你喊。「這一點也不好笑！！」
"Aren't you going to pour the wine?" she says, her eyes flashing.	「你不倒酒？」她說，眼神閃閃發光。
"I'm ready when you are, honey!"\n\nCome on, Larry; what are you waiting for?	「你準備好我就準備，親愛的！」\n\nLarry，你在等什麼？
She looks like she could use some of that wine.	她看起來需要點那瓶酒。
There's no wine here.	這裡沒酒。
Right. Sure. Pour another for her while you're at it!	對啊，倒一杯給她吧！
You grab the bottle, and fortify your courage with a long, hard belt!	你抓起酒瓶，喝了長長一口給自己壯膽！
You carefully remove the bottle from the wine bucket, unscrew the cap, and pour two glasses. She downs her glass immediately, you refill it, and she does it again. Her eyes meet yours, and you're sure luck is with you this time!	你小心地從酒桶裡取出酒瓶，擰開蓋子，倒了兩杯。她一口乾了，你又倒，她再乾一杯。眼神相交，你確信這次交好運了！
This room doesn't even have a telephone!	這房間根本沒電話！
It's pretty complicated. There's a knob that says "On."	挺複雜的。有個寫著「開」的旋鈕。
The radio IS off.	收音機確實關了。
The radio IS on.	收音機確實開著。
"Ooh, Baby!\n\nThat feels so good!\n\nOoooooooooh!!"	「喔，寶貝！\n\n好舒服！\n\n喔—！」
"Hey, what's the deal with the rope?"	「嘿，為什麼綁繩子？」
"Why are you tying me to the bed?"	「你為什麼要把我綁在床上？」
You have more important things on your mind than sitting.	你腦子裡想的比坐著重要得多。
This window doesn't open.	窗戶打不開。
The tuning knob on the radio is stuck. Looks like you're stuck with the Easy Listening station.	收音機的調頻鈕卡住了。看來你得聽輕音樂頻道了。
You can't move the knob, but it doesn't matter since the radio isn't on anyway!	旋鈕轉不動，不過反正收音機沒開，也就無所謂了。
You see the lights of Lost Wages spread out before you.	眼前鋪開 Lost Wages 的夜景。
"Oh, Larry, it's you!" Fawn says. "I thought it was that cute, young delivery boy again."	「喔，Larry，是你！」Fawn 說。「我以為又是那個可愛的年輕外送員。」
Hmmm. Was "Tuesday" a good year?	嗯？「星期二」是好年份嗎？
It's a table model, not a portable.	是桌上型的，不是便攜式。
Besides, the hotel bolted it to the table.	況且旅館把它鎖在桌子上。
You are unable to break the window.	你破不了窗戶。
You can't. It's the same brand that people can't break when they want to christen a ship!	不行。這牌子的玻璃連人家要砸碎它來命名船隻時都砸不碎！
Don't you think a heart-shaped bed is trite?	你不覺得心形床俗氣嗎？
You can't. The delivery boy glued it to the table.	不行。外送員把它膠死在桌子上。
"FAWN!! You scum-sucking gutter slug, get back in here!"	「Fawn！！你這下水道裡的爛蛞蝓，滾回來！」
Unfortunately, your pleas go unheeded.	可惜沒人聽你的哀求。
"Say, Fawn, when are you going to get undressed?"	「嘿，Fawn，你什麼時候脫衣服？」
Hmmm. You wonder if there's any way a guy can "consummate" by himself?	嗯？你在想有沒有辦法一個人「圓滿」？
Larry, it looks like "the honeymoon's over."	Larry，看來「蜜月結束了。」
As she heads out the door, she laughs and says, "So long, turkey!"	她邊走邊笑著說：「拜了，蠢蛋！」
%m14 A beautiful security guard sits behind a desk.	%m14 一位漂亮保安坐在辦公桌後。
She takes one look at the bottle of Spanish Fly and says, "Boy, thanks! How did you know that I love this stuff?!" She tosses down a couple of pills, then a few more, and finally gulps the whole bottle! Her breathing becomes faster and faster until she begins to pant.	她看到西班牙蒼蠅藥瓶眼睛一亮，說：「天哪，謝謝！你怎麼知道我喜歡這玩意？！」她吞了幾粒，再吞幾粒，最後整瓶灌下去！呼吸越來越急促，直到開始喘息。
She is a knockout! But that pair of pistols slung around her hips brings a sense of foreboding to your gut.	她漂亮死了！但腰間那對槍帶給你一股不祥的預感。
(Looks like tonight's your lucky night, Larry.)	（看來今晚是你的幸運日，Larry。）
The rumors were right. You are quick on the trigger, Larry!	謠言沒錯。你這傢伙確實很急色，Larry！
"Try it, and I'll blow your head off."	「敢動歪念，我就開槍斃了你。」
Evidently, this exit is for employees only. You'd better use the elevator.	很明顯，這出口只限員工。還是用電梯吧。
The beautiful security guard is sitting at the desk. A pair of large pistols are in a holster around her slim waist. She looks friendly, but quick on the trigger.	漂亮的保安坐在辦公桌後。她纖細腰間的全套槍套亮閃閃的。看起來友善，但扳機很快。
Since you're no longer staring at Faith's ample weapons, you notice an unlabeled button on her desk.	既然你不再盯著 Faith 的「宏偉武器」看，你注意到她辦公桌上有個沒標籤的按鈕。
Oh, oh. Where are we goin' now, Larry?	咦呀，現在去哪，Larry？
You are at the top floor of the hotel.	你在旅館頂樓。
%m14 That desk is where you lost your Faith, remember? (So glad there was a chance to use THAT line!)	%m14 就是在那張辦公桌你失去了 Faith，記得吧？（終於用上這句話了！）
A brass plate near the elevator says: "Private."	電梯旁的銅牌寫著：「私人專用」。
"Hi, my name's Faith. Nice suit!"	「嗨，我叫 Faith。不錯的西裝！」
"Bad breath's one thing, Mister; but, you could knock a buzzard off a manure truck!"	「口臭算是小事，仁兄，但你能把禿鷲從糞堆上打下來！」
"Touch that button, and you're dead meat, White-Suit!"	「敢碰那個按鈕，白西裝，你死定了！」
"So long!" Faith says. "I've got to find my boy friend before this stuff wears off!"	「拜了！」Faith 說。「得在藥效退前找到我男友！」
The penthouse elevator doors glide open.	頂樓電梯門滑開。
